{
  "$schema": "https://json-schema.org/draft/2020-12/schema",
  "$id": "https://mtp.schemas.databiomes.com/v2/bloom_2_0_1.json",
  "title": "Protocol",
  "description": "Main model for MTP Protocol JSON structure.",
  "$defs": {
    "Guardrail": {
      "description": "Model for guardrails configuration.",
      "properties": {
        "index": {
          "minimum": 0,
          "title": "Index",
          "type": "integer"
        },
        "good_prompt": {
          "minLength": 1,
          "title": "Good Prompt",
          "type": "string"
        },
        "bad_prompt": {
          "minLength": 1,
          "title": "Bad Prompt",
          "type": "string"
        },
        "bad_output": {
          "minLength": 1,
          "title": "Bad Output",
          "type": "string"
        },
        "bad_examples": {
          "description": "At least 3 bad examples per guardrail.",
          "items": {
            "type": "string"
          },
          "minItems": 3,
          "title": "Bad Examples",
          "type": "array"
        }
      },
      "required": [
        "index",
        "good_prompt",
        "bad_prompt",
        "bad_output"
      ],
      "title": "Guardrail",
      "type": "object"
    },
    "Instruction": {
      "description": "Model for instruction configuration.",
      "properties": {
        "memory": {
          "description": "Input lines plus response (e.g. inputs + 1).",
          "minimum": 1,
          "title": "Memory",
          "type": "integer"
        },
        "sets": {
          "items": {
            "$ref": "#/$defs/InstructionSet"
          },
          "minItems": 1,
          "title": "Sets",
          "type": "array"
        }
      },
      "required": [
        "memory",
        "sets"
      ],
      "title": "Instruction",
      "type": "object"
    },
    "InstructionSet": {
      "description": "Model for instruction sets.",
      "properties": {
        "name": {
          "anyOf": [
            {
              "minLength": 1,
              "type": "string"
            },
            {
              "type": "null"
            }
          ],
          "default": null,
          "description": "Name of the instruction set.",
          "title": "Name"
        },
        "guardrails": {
          "items": {
            "$ref": "#/$defs/Guardrail"
          },
          "title": "Guardrails",
          "type": "array"
        },
        "context": {
          "description": "Instruction context lines.",
          "items": {
            "type": "string"
          },
          "title": "Context",
          "type": "array"
        },
        "set": {
          "description": "Token set rows.",
          "items": {
            "items": {
              "type": "string"
            },
            "type": "array"
          },
          "title": "Set",
          "type": "array"
        },
        "samples": {
          "description": "At least three samples per instruction set.",
          "items": {
            "$ref": "#/$defs/Sample"
          },
          "minItems": 3,
          "title": "Samples",
          "type": "array"
        },
        "ppo": {
          "items": {
            "additionalProperties": true,
            "type": "object"
          },
          "title": "Ppo",
          "type": "array"
        }
      },
      "required": [
        "set",
        "samples"
      ],
      "title": "InstructionSet",
      "type": "object"
    },
    "Sample": {
      "description": "Model for instruction samples.",
      "properties": {
        "strings": {
          "description": "Snippet strings per input/response.",
          "items": {
            "type": "string"
          },
          "minItems": 1,
          "title": "Strings",
          "type": "array"
        },
        "prompt": {
          "anyOf": [
            {
              "type": "string"
            },
            {
              "type": "null"
            }
          ],
          "default": null,
          "title": "Prompt"
        },
        "numbers": {
          "anyOf": [
            {
              "type": "integer"
            },
            {
              "items": {
                "type": "integer"
              },
              "type": "array"
            },
            {
              "items": {
                "items": {
                  "type": "integer"
                },
                "type": "array"
              },
              "type": "array"
            }
          ],
          "title": "Numbers"
        },
        "number_lists": {
          "anyOf": [
            {
              "type": "integer"
            },
            {
              "items": {
                "type": "integer"
              },
              "type": "array"
            },
            {
              "items": {
                "items": {
                  "type": "integer"
                },
                "type": "array"
              },
              "type": "array"
            },
            {
              "items": {
                "items": {
                  "items": {
                    "type": "integer"
                  },
                  "type": "array"
                },
                "type": "array"
              },
              "type": "array"
            }
          ],
          "title": "Number Lists"
        },
        "result": {
          "description": "Final token value for this sample.",
          "minLength": 1,
          "title": "Result",
          "type": "string"
        },
        "value": {
          "anyOf": [
            {
              "type": "string"
            },
            {
              "type": "integer"
            },
            {
              "type": "number"
            },
            {
              "items": {
                "type": "integer"
              },
              "type": "array"
            },
            {
              "items": {
                "type": "number"
              },
              "type": "array"
            },
            {
              "type": "null"
            }
          ],
          "default": null,
          "title": "Value"
        }
      },
      "required": [
        "strings",
        "numbers",
        "number_lists",
        "result"
      ],
      "title": "Sample",
      "type": "object"
    },
    "TokenInfo": {
      "description": "Model for individual token information.",
      "properties": {
        "key": {
          "description": "Token key; alphanumeric, underscore, and emoji allowed.",
          "minLength": 1,
          "title": "Key",
          "type": "string"
        },
        "num": {
          "title": "Num",
          "type": "boolean"
        },
        "num_list": {
          "description": "Number of list dimensions for num_list tokens.",
          "minimum": 0,
          "title": "Num List",
          "type": "integer"
        },
        "min_value": {
          "anyOf": [
            {
              "type": "integer"
            },
            {
              "type": "number"
            },
            {
              "type": "null"
            }
          ],
          "default": null,
          "title": "Min Value"
        },
        "max_value": {
          "anyOf": [
            {
              "type": "integer"
            },
            {
              "type": "number"
            },
            {
              "type": "null"
            }
          ],
          "default": null,
          "title": "Max Value"
        },
        "length": {
          "anyOf": [
            {
              "type": "integer"
            },
            {
              "type": "null"
            }
          ],
          "default": null,
          "title": "Length"
        },
        "desc": {
          "anyOf": [
            {
              "type": "string"
            },
            {
              "type": "null"
            }
          ],
          "default": null,
          "title": "Desc"
        },
        "special": {
          "anyOf": [
            {
              "type": "string"
            },
            {
              "type": "null"
            }
          ],
          "default": null,
          "title": "Special"
        },
        "type": {
          "enum": [
            "Token",
            "SpecialToken",
            "SpecialFinalToken",
            "NumToken",
            "FinalToken",
            "FinalNumToken",
            "NumListToken"
          ],
          "title": "Type",
          "type": "string"
        }
      },
      "required": [
        "key",
        "num",
        "num_list",
        "type"
      ],
      "title": "TokenInfo",
      "type": "object"
    }
  },
  "additionalProperties": true,
  "properties": {
    "name": {
      "minLength": 1,
      "title": "Name",
      "type": "string"
    },
    "inputs": {
      "title": "Inputs",
      "type": "integer"
    },
    "model_type": {
      "enum": [
        "generative",
        "state_machine",
        "multi_classifier"
      ],
      "title": "Model Type",
      "type": "string"
    },
    "encrypted": {
      "title": "Encrypted",
      "type": "boolean"
    },
    "valid": {
      "title": "Valid",
      "type": "boolean"
    },
    "context": {
      "description": "Protocol-level context lines.",
      "items": {
        "type": "string"
      },
      "title": "Context",
      "type": "array"
    },
    "tokens": {
      "additionalProperties": {
        "$ref": "#/$defs/TokenInfo"
      },
      "title": "Tokens",
      "type": "object"
    },
    "special_tokens": {
      "items": {
        "type": "string"
      },
      "title": "Special Tokens",
      "type": "array"
    },
    "instruction": {
      "$ref": "#/$defs/Instruction"
    }
  },
  "required": [
    "name",
    "inputs",
    "model_type",
    "encrypted",
    "valid",
    "tokens",
    "instruction"
  ],
  "type": "object"
}