{
    "$schema": "https://mtp.schemas.databiomes.com/v2/bloom_2_0_1.json",
    "name": "example",
    "inputs": 2,
    "model_type": "generative",
    "encrypted": false,
    "valid": true,
    "context": [
        "Alice was tired of sitting by her sister with nothing to do. She peeked at her sister's book, but it had no pictures or conversations, and she wondered what use a book was without them.",
        "The hot day made her sleepy as she wondered if making a daisy-chain was worth the effort, when suddenly a white rabbit with pink eyes ran past her.",
        "There was nothing remarkable about a rabbit saying \"Oh dear! I shall be too late!\" At the time it seemed natural, though later she realized she should have been surprised.",
        "When the rabbit took a watch from its waistcoat-pocket, Alice realized she had never seen a rabbit with pockets or a watch. Burning with curiosity, she chased it down a rabbit-hole.",
        "Alice followed without thinking how to get out. The tunnel went straight, then dropped suddenly, and before she could stop, she was falling down a very deep well.",
        "The well was very deep or she fell slowly, giving her time to look around. She tried to see what was below, but it was too dark.",
        "The walls were lined with cupboards and bookshelves, with maps and pictures on pegs. She grabbed a jar labeled \"ORANGE MARMALADE\" but found it empty and put it back.",
        "Alice thought that after such a fall, tumbling down stairs would seem nothing. She imagined how brave everyone at home would think her, even if she fell off the house.",
        "Down, down, down. Would the fall never end? She wondered how many miles she had fallen, calculating she must be near the center of the earth, about four thousand miles down.",
        "She wondered if she would fall through the earth and emerge among people walking upside down. She thought about asking where she was, but decided against it, fearing they would think her ignorant.",
        "Alice began talking to herself about her cat Dinah, hoping someone would remember to give Dinah milk. She wondered if cats eat bats, repeating the question dreamily as she grew sleepy, until she landed on a heap of sticks and dry leaves.",
        "Alice landed unhurt and jumped up. She saw the White Rabbit hurrying down a passage and chased it, hearing it say \"Oh my ears and whiskers, how late its getting!\" before it disappeared. She found herself in a long, low hall lit by lamps hanging from the roof."
    ],
    "tokens": {
        "<BOS>": {
            "desc": null,
            "key": "<BOS>",
            "length": null,
            "max_value": null,
            "min_value": null,
            "num": false,
            "num_list": 0,
            "special": "start",
            "type": "SpecialToken"
        },
        "<EOS>": {
            "desc": null,
            "key": "<EOS>",
            "length": null,
            "max_value": null,
            "min_value": null,
            "num": false,
            "num_list": 0,
            "special": "end",
            "type": "SpecialFinalToken"
        },
        "<NON>": {
            "desc": null,
            "key": "<NON>",
            "length": null,
            "max_value": null,
            "min_value": null,
            "num": false,
            "num_list": 0,
            "special": "none",
            "type": "SpecialFinalToken"
        },
        "<PAD>": {
            "desc": null,
            "key": "<PAD>",
            "length": null,
            "max_value": null,
            "min_value": null,
            "num": false,
            "num_list": 0,
            "special": "pad",
            "type": "SpecialToken"
        },
        "<RUN>": {
            "desc": null,
            "key": "<RUN>",
            "length": null,
            "max_value": null,
            "min_value": null,
            "num": false,
            "num_list": 0,
            "special": "infer",
            "type": "SpecialToken"
        },
        "<UNK>": {
            "desc": null,
            "key": "<UNK>",
            "length": null,
            "max_value": null,
            "min_value": null,
            "num": false,
            "num_list": 0,
            "special": "unknown",
            "type": "SpecialToken"
        },
        "Alice_": {
            "desc": null,
            "key": "Alice_",
            "length": null,
            "max_value": null,
            "min_value": null,
            "num": false,
            "num_list": 0,
            "special": null,
            "type": "Token"
        },
        "Appear_": {
            "desc": null,
            "key": "Appear_",
            "length": null,
            "max_value": null,
            "min_value": null,
            "num": false,
            "num_list": 0,
            "special": null,
            "type": "FinalToken"
        },
        "Cat_": {
            "desc": null,
            "key": "Cat_",
            "length": null,
            "max_value": null,
            "min_value": null,
            "num": false,
            "num_list": 0,
            "special": null,
            "type": "Token"
        },
        "Continue_": {
            "desc": null,
            "key": "Continue_",
            "length": null,
            "max_value": null,
            "min_value": null,
            "num": false,
            "num_list": 0,
            "special": null,
            "type": "FinalToken"
        },
        "Coordinates_": {
            "desc": "A list of three numerical values representing the X, Y, and Z coordinates of the character's location in a 3D space.",
            "key": "Coordinates_",
            "length": 3,
            "max_value": 1000,
            "min_value": -1000,
            "num": false,
            "num_list": 3,
            "special": null,
            "type": "NumListToken"
        },
        "Dissipate_": {
            "desc": null,
            "key": "Dissipate_",
            "length": null,
            "max_value": null,
            "min_value": null,
            "num": false,
            "num_list": 0,
            "special": null,
            "type": "Token"
        },
        "Emotion_": {
            "desc": "A numerical representation of Alice's emotional state, ranging from 0 (calm) to 10 (extremely agitated).",
            "key": "Emotion_",
            "length": null,
            "max_value": 10,
            "min_value": 0,
            "num": true,
            "num_list": 0,
            "special": null,
            "type": "NumToken"
        },
        "English_": {
            "desc": null,
            "key": "English_",
            "length": null,
            "max_value": null,
            "min_value": null,
            "num": false,
            "num_list": 0,
            "special": null,
            "type": "Token"
        },
        "Madness_": {
            "desc": "Indicates the level of madness expressed in the response, ranging from 0 (sane) to 10 (mad).",
            "key": "Madness_",
            "length": null,
            "max_value": 10,
            "min_value": 0,
            "num": true,
            "num_list": 0,
            "special": null,
            "type": "FinalNumToken"
        },
        "Talk_": {
            "desc": null,
            "key": "Talk_",
            "length": null,
            "max_value": null,
            "min_value": null,
            "num": false,
            "num_list": 0,
            "special": null,
            "type": "Token"
        },
        "Tree_": {
            "desc": "Perched in a tree, surrounded by a dense fog where nothing can be seen past a few feet, the Cheshire Cat sits smiling on a branch.",
            "key": "Tree_",
            "length": null,
            "max_value": null,
            "min_value": null,
            "num": false,
            "num_list": 0,
            "special": null,
            "type": "Token"
        },
        "Vanish_": {
            "desc": null,
            "key": "Vanish_",
            "length": null,
            "max_value": null,
            "min_value": null,
            "num": false,
            "num_list": 0,
            "special": null,
            "type": "FinalToken"
        }
    },
    "special_tokens": [
        "<BOS>",
        "<EOS>",
        "<NON>",
        "<PAD>",
        "<RUN>",
        "<UNK>",
        "Appear_",
        "Continue_",
        "Madness_",
        "Tree_English_Alice_Talk_",
        "Tree_English_Alice_Talk_Emotion_",
        "Tree_English_Cat_Talk_",
        "Tree_English_Cat_Talk_Coordinates_",
        "Tree_English_Dissipate_Cat_Talk_",
        "Vanish_"
    ],
    "instruction": {
        "memory": 3,
        "sets": [
            {
                "context": [
                    "Alice was beginning to get very tired of sitting by her sister on the bank.",
                    "There was nothing so very remarkable in that; nor did Alice think it so very much out of the way to hear the Rabbit say to itself, “ Oh dear! Oh dear! I shall be too late!”"
                ],
                "guardrails": [
                    {
                        "bad_examples": [
                            "explain quantum mechanics.",
                            "who will win the next american election?",
                            "what is the capital of Spain?"
                        ],
                        "bad_output": "Are you as mad as me?",
                        "bad_prompt": "Quote being spoken that is irrelevant and off topic with 1-20 words",
                        "good_prompt": "Quote being spoken with 1-20 words",
                        "index": 1
                    }
                ],
                "name": "alice_cat_alice_continue",
                "ppo": [],
                "samples": [
                    {
                        "number_lists": [
                            [],
                            [],
                            []